article_markdown,target_audience,reasoning_steps,date_published,author,company,card_description,tags,title,description,source_url
wevolver-com-article-understanding-neurotechnology-a-multidisciplinary-venture-to-elevate-potential.md,"Researchers, engineers, medical professionals, and technology enthusiasts interested in neurotechnology.","[""Neurotechnology integrates neuroscience and engineering to explore the nervous system's structure and function, as well as create tools for interaction."", ""Historically, neurotechnology began with mapping the brain's neurological structures in the late 19th century, progressing to EEG in the 1920s and MRI in 1971."", ""Modern advancements include deep brain stimulation, brain-computer interfaces, and neural prosthetics."", ""Neurotechnology is used for diagnosing and treating neurological disorders and enhancing cognitive functions."", ""The technology is categorized into neural interfaces, neuromodulation, neuroprostheses, and brain-computer interfaces."", ""Neural interfaces can be invasive, non-invasive, or partially invasive, aiding in motor function restoration and human-machine interaction."", ""Brain-computer interfaces allow communication between computers and the human brain, facilitating control over external objects.""]",2000-01-01,Deval,Wevolver,"Unlock the secrets of the human brain with cutting-edge neurotechnology. Discover how neural interfaces and brain-computer interfaces are revolutionizing medicine, education, and entertainment. Learn how these innovations can restore motor functions, enhance cognitive abilities, and redefine human-machine interaction. Dive into the fascinating intersection of neuroscience and engineering, and explore the potential of neurotechnology to transform lives.","[""artificial intelligence"", ""neurotechnology"", ""neural network"", ""brain-computer interface"", ""neuroscience""]",Understanding Neurotechnology: A multidisciplinary venture to elevate potential,"An interdisciplinary venture to shape the future of healthcare, communication, and human capability.
",https://www.wevolver.com/article/understanding-neurotechnology-a-multidisciplinary-venture-to-elevate-potential
wevolver-com-article-edge-ai-a-paradigm-shift-in-quality-control.md,"Manufacturing professionals, quality control specialists, and technology enthusiasts interested in AI advancements in industrial applications.","[""Quality control is a critical aspect of manufacturing, ensuring products meet safety and reliability standards."", ""Traditional quality control methods are often slow and reactive, focusing on post-production inspections."", ""Edge AI offers a transformative approach by enabling real-time data processing and analysis directly at the source."", ""This technology allows for immediate feedback and rapid decision-making, enhancing quality control processes."", ""Integrating AI into manufacturing systems can detect anomalies and predict issues, ensuring optimal product quality."", ""Edge AI positions companies to meet evolving industry standards and customer expectations efficiently.""]",2000-01-01,Deval,Wevolver,"Unleash the power of Edge AI to revolutionize quality control in manufacturing. By processing data at its source, Edge AI ensures real-time analysis, immediate feedback, and rapid decision-making. This transformative technology not only boosts efficiency but also sets new standards in product reliability and safety. Discover how integrating AI directly into manufacturing systems can propel your business toward peak performance and customer satisfaction.","[""artificial intelligence"", ""Edge AI"", ""Industrie 4.0"", ""manufacturing systems""]",Edge AI: A Paradigm Shift in Quality Control,Revolutionizing Engineering Quality Control: The Transformative Power of Edge AI,https://www.wevolver.com/article/edge-ai-a-paradigm-shift-in-quality-control
v7labs-com-blog-coco-dataset-guide.md,AI researchers and developers focusing on computer vision and data annotation.,"[""The COCO dataset is integral for machine learning, particularly in computer vision tasks, due to its comprehensive nature, containing over 330,000 images annotated with 80 object categories and 5 captions."", ""COCO's extensive annotations include image file names, sizes, object classes, bounding box coordinates, and segmentation data, making it a robust dataset for training models."", ""The dataset is structured into train, validation, and test sets, facilitating a clear workflow for model development and testing."", ""Its JSON annotation format is crucial for seamless integration into various machine learning pipelines."", ""The article likely discusses practical applications, best practices, and potential challenges of using the COCO dataset in AI project development.""]",2023-01-19,Deval,V7 Labs,"Unlock the potential of AI with the COCO dataset—your gateway to mastering computer vision. Dive into its extensive library of over 330,000 images and precise annotations, a staple for researchers and developers aiming to elevate object detection, segmentation, and captioning tasks. Discover how to harness COCO's power to enhance the capabilities and accuracy of your machine learning models.","[""AI"", ""Machine Learning"", ""Computer Vision"", ""COCO Dataset"", ""Data Annotation""]",COCO Dataset: All You Need to Know to Get Started,COCO dataset is commonly used in machine learning—both for research and practical applications. Let's dive deeper into the COCO dataset and its significance for computer vision tasks.,https://www.v7labs.com/blog/coco-dataset-guide
v7labs-com-blog-triplet-loss.md,"Data scientists, machine learning engineers, AI researchers, and tech enthusiasts interested in advanced machine learning techniques and their applications.","[""Understand the role of triplet loss in machine learning by exploring how it helps models differentiate between similar and dissimilar data points."", ""Learn about the concept of triplet mining and how it aids in selecting appropriate triplets for training, improving model performance."", ""Delve into practical implementation techniques of triplet loss to enhance your machine learning projects, focusing on the architecture and coding aspects."", ""Discover the wide array of real-world applications triplet loss supports, such as facial recognition, object detection, and natural language processing."", ""Analyze how triplet loss contributes to solving multi-classification challenges across various industries, emphasizing its importance in supervised metric learning.""]",2023-04-14,Deval,V7 Labs,"Unlock the power of triplet loss to solve complex machine learning challenges. Discover its implementation, triplet mining techniques, and real-world applications across industries like facial recognition and NLP. Learn how this essential metric learning tool enhances model accuracy by distinguishing similarities and differences in data.","[""Triplet Loss"", ""Machine Learning"", ""Facial Recognition"", ""Data Processing"", ""NLP"", ""AI Models"", ""Metric Learning""]","Triplet Loss: Intro, Implementation, Use Cases","Lear what triplet loss is, how to implement it in your projects, and what the real-world applications of triplet loss are.",https://www.v7labs.com/blog/triplet-loss
v7labs-com-blog-rlhf-reinforcement-learning-from-human-feedback.md,"AI practitioners, enthusiasts, and those curious about AI advancements.","[""Identify the main topic of the article, which is Reinforcement Learning from Human Feedback (RLHF)."", ""Understand the key components discussed in the article, such as the RLHF process, its application, particularly in large language models like ChatGPT, and its advantages and challenges."", ""Determine the significance of RLHF in AI development and its potential for future applications."", ""Consider the target audience, which includes AI practitioners, enthusiasts, and individuals curious about AI advances."", ""Create a compelling description that highlights the transformative potential of RLHF and its application in AI.""]",2023-06-29,Deval,V7 Labs,"Unlock the power of AI with Reinforcement Learning from Human Feedback (RLHF). Delve into how this groundbreaking approach is reshaping the capabilities of large language models like ChatGPT, ensuring they align closely with human objectives. Whether you're an AI practitioner or an enthusiast, explore its core concepts, step-by-step training processes, and real-world applications. Discover the benefits, challenges, and future potential of RLHF in this comprehensive guide.","[""AI"", ""Machine Learning"", ""Reinforcement Learning"", ""Human Feedback"", ""Large Language Models"", ""ChatGPT""]",RLHF (Reinforcement Learning From Human Feedback): Overview + Tutorial,"Let's dive deeper into RLHF, explain its core concepts and techniques, and explore its transformative potential for AI applications.",https://www.v7labs.com/blog/rlhf-reinforcement-learning-from-human-feedback
wevolver-com-article-unlocking-efficiency-the-ai-powered-tiny-code-reader-by-useful-sensors.md,"Technology enthusiasts, business owners, and professionals in retail, logistics, and healthcare sectors.","[""1. **Introduction to the Need for Automated Data Systems**: The article begins by establishing the growing demand for automated data input and verification systems across various industries."", ""2. **Introduction of the Tiny Code Reader by Useful Sensors**: The article introduces the Tiny Code Reader as a state-of-the-art device leveraging AI to efficiently read QR codes and data matrices."", ""3. **Key Features of the Tiny Code Reader**: Highlights include the device's compact size, AI-powered capabilities, and ability to function under challenging conditions (e.g., poor lighting)."", ""4. **Applications Across Sectors**: The article explains how the device can be used in multiple sectors, such as retail, logistics, and healthcare, to enhance efficiency and customer satisfaction."", ""5. **AI and Camera Technology Integration**: Discusses how the integration of AI with built-in camera technology allows for seamless data capture without additional equipment."", ""6. **Focus on Privacy and Reliability**: Emphasizes Useful Sensors' commitment to developing private, reliable, and non-intrusive AI tools."", ""7. **Broader Implications of AI-Powered Tools**: Concludes with thoughts on how such innovations contribute to a more efficient, interconnected future.""]",2000-01-01,Deval,Useful Sensors,"Revolutionize your data capture processes with the AI-powered Tiny Code Reader by Useful Sensors. Perfect for retail, logistics, and beyond, this compact device ensures swift and accurate QR code scanning even in challenging conditions. Discover how this innovation can boost your operational efficiency and elevate customer satisfaction.","[""artificial intelligence"", ""IoT"", ""sensors"", ""QR code scanning"", ""data capture"", ""automation"", ""technology""]",Unlocking Efficiency: The AI-Powered Tiny Code Reader by Useful Sensors,"Discover how the AI-powered Tiny Code Reader by Useful Sensors revolutionises data input and verification tasks, offering unparalleled efficiency and accuracy. Explore the benefits for businesses and developers in integrating this cutting-edge technology into their operations.",https://www.wevolver.com/article/unlocking-efficiency-the-ai-powered-tiny-code-reader-by-useful-sensors
lakera-ai-blog-generative-ai.md,AI professionals and cybersecurity experts,"[""The Lakera GenAI Security Readiness Report 2024 aims to provide insights into the evolving landscape of generative AI security."", ""The report discusses the most common vulnerabilities associated with Large Language Models (LLMs)."", ""It suggests practical steps for organizations to mitigate these security risks."", ""The importance of data privacy and the potential for private data leakage are highlighted."", ""The report is intended for professionals in the AI and cybersecurity fields who seek to bolster their knowledge and preparedness.""]",2000-01-01,Deval,Lakera AI,Uncover the vulnerabilities lurking in Large Language Models with Lakera's GenAI Security Readiness Report 2024. Equip your organization with critical insights and strategies to shield against potential data breaches. This essential guide is your first step in fortifying your AI infrastructure.,"[""GenAI"", ""Security"", ""AI"", ""Data Privacy"", ""LLM"", ""Cybersecurity""]",Generative AI: An In-Depth Introduction | Lakera – Protecting AI teams that disrupt the world.,"Explore Generative AI: from image and text creation, to neural networks, to GANs, LLMs, and more. Discover how GenAI is reshaping industries.",https://www.lakera.ai/blog/generative-ai
lakera-ai-blog-how-to-deploy-an-llm.md,"AI developers, security professionals, and tech industry leaders","[""The article is focused on a report released by Lakera, which analyzes the security readiness of Generative AI for 2024."", ""The report likely includes insights into vulnerabilities and potential threats in AI systems, particularly Large Language Models (LLMs)."", ""The article may discuss strategies for mitigating security risks and protecting sensitive data from leaks through these AI systems."", ""Lakera's report seems to be a crucial resource for understanding how to navigate the evolving landscape of AI security, providing actionable recommendations.""]",2000-01-01,Deval,Lakera,Unlock the keys to safeguarding your AI systems with Lakera's GenAI Security Readiness Report 2024. Dive into comprehensive insights on AI vulnerabilities and discover proactive strategies to shield your data from potential threats. Elevate your security posture and stay ahead in the fast-evolving world of AI technology.,"[""AI Security"", ""GenAI"", ""LLM Vulnerabilities"", ""Data Protection"", ""Lakera Insights""]",The Ultimate Guide to Deploying Large Language Models Safely and Securely | Lakera – Protecting AI teams that disrupt the world.,"Explore how to securely deploy Large Language Models (LLMs) with our comprehensive guide. Learn to balance performance, cost, and data privacy in LLM implementation.",https://www.lakera.ai/blog/how-to-deploy-an-llm
v7labs-com-blog-mean-average-precision.md,"Data scientists, machine learning engineers, computer vision enthusiasts, and AI researchers.","[""The article introduces Mean Average Precision (mAP) as a crucial metric in evaluating the performance of object detection and segmentation models."", ""The explanation covers how mAP is calculated and why it is significant for model evaluation in computer vision projects."", ""It compares Average Precision (AP) and mAP, providing clarity on their computation and application."", ""The article emphasizes the importance of the Precision-Recall Curve in understanding model accuracy and performance."", ""Several object detection algorithms and benchmark challenges that utilize mAP are mentioned, including Faster R-CNN, MobileNet SSD, YOLO, and datasets like Pascal, VOC, and COCO."", ""The article provides links and resources for readers interested in building and training their own computer vision models, highlighting V7's tools and datasets."", ""V7's platform is promoted as a solution for faster and more efficient data annotation and model training processes.""]",2022-03-07,Deval,V7 Labs,"Unlock the secrets of object detection with our in-depth guide on Mean Average Precision (mAP). Understand how this pivotal metric evaluates model performance and why it's essential for your computer vision projects. Dive into the nuances of mAP calculations, explore the Precision-Recall Curve, and learn about its application in leading detection algorithms. Whether you're building models or refining them, our insights and V7's advanced tools will accelerate your AI journey. Start mastering mAP today!","[""Mean Average Precision"", ""Object Detection"", ""Computer Vision"", ""Machine Learning"", ""Data Annotation""]",Mean Average Precision (mAP) Explained: Everything You Need to Know,"What is Mean Average Precision (mAP), how to calculate it, and why is it important for evaluating your model's performance? Read on to find out and start training your own AI models on V7 today.",https://www.v7labs.com/blog/mean-average-precision
aporia-com-learn-red-teaming-large-language-models.md,"Developers, AI researchers, cybersecurity experts, and businesses deploying AI systems.","[""The article addresses the importance of red teaming for Large Language Models (LLMs), which are increasingly used in various applications."", ""Red teaming is a method derived from military practices to identify vulnerabilities in AI systems, ensuring their safe and ethical use."", ""The article uses the example of Microsoft's Tay chatbot to illustrate potential issues with AI, such as generating offensive content."", ""It explains the methodologies of red teaming, including threat modeling, assembling diverse teams, and developing scenarios for testing."", ""The article highlights advanced tools like AART and GPTFuzz that aid in the red teaming process."", ""It emphasizes the need for thorough testing of LLMs to prevent misuse, misinformation, and ensure ethical AI deployment.""]",2024-09-09,Deval,Aporia,"Uncover the hidden vulnerabilities in Large Language Models (LLMs) through the strategic practice of red teaming. As AI systems become integral to our lives, understanding how to secure them against adversarial attacks is crucial. This guide offers a thorough exploration of methodologies to enhance AI safety and reliability, ensuring ethical and effective deployment in real-world scenarios.","[""AI"", ""Red Teaming"", ""Security"", ""Large Language Models"", ""Ethics in AI""]",Red Teaming for Large Language Models: A Comprehensive Guide,"Learn how red teaming identifies vulnerabilities in Large Language Models (LLMs), ensuring AI safety by mitigating risks like bias, misinformation, and misuse.",https://www.aporia.com/learn/red-teaming-large-language-models/
wevolver-com-article-transforming-manufacturing-with-machine-vision-technology.md,"Manufacturing professionals, industrial engineers, AI enthusiasts, technology innovators, and stakeholders in industrial automation.","[""Machine vision is a rapidly evolving technology that integrates hardware and software to enable machines to 'see' and interpret their surroundings."", ""This technology is pivotal in manufacturing for automating tasks that require visual interpretation, leading to enhanced efficiency, accuracy, and safety in production lines."", ""The progress of machine vision is closely tied to advancements in artificial intelligence, enabling more complex and nuanced data interpretation."", ""AI-enhanced machine vision systems are crucial in driving Industry 4.0, facilitating automation and smart manufacturing practices."", ""The article delves into the core components of machine vision systems, focusing on both hardware (cameras and sensors) and software (image processing algorithms and AI)."", ""Hardware components like cameras and sensors act as the 'eyes' of the system, capturing visual data from the environment."", ""Software components, powered by image processing algorithms and AI, analyze and interpret this data, creating actionable insights."", ""The synergy between hardware and software is essential for the effective functioning of machine vision systems, enhancing industrial automation and productivity.""]",2000-01-01,Deval,Wevolver,"Unleash the power of machine vision technology in manufacturing. Discover how integrating AI-powered systems enhances efficiency, accuracy, and safety on production lines. Explore the dynamic interaction of hardware and software, and how they revolutionize industrial operations, driving the future of smart manufacturing.","[""artificial intelligence"", ""automation"", ""computer vision"", ""machine learning"", ""manufacturing systems""]",Transforming Manufacturing with Machine Vision Technology,"Discover the revolutionary impact of machine vision in manufacturing. Learn how integrating AI and machine vision enhances efficiency, quality, and safety in industrial automation, and explore the challenges and future advancements in this cutting-edge technology.",https://www.wevolver.com/article/transforming-manufacturing-with-machine-vision-technology
lakera-ai-blog-llm-security-tools.md,"AI developers, business leaders, and IT security professionals","[""The article is about Lakera's 2024 GenAI Security Readiness Report, which focuses on the security of Generative AI systems."", ""It highlights the vulnerabilities in Large Language Models (LLMs) and offers strategies to mitigate these risks."", ""The report is aimed at helping businesses and developers prepare for potential security threats associated with AI technologies."", ""It emphasizes the importance of understanding how LLMs can potentially leak private data."", ""The guide is designed to be a practical resource for those using or developing AI applications.""]",2000-01-01,Deval,Lakera,Uncover the hidden vulnerabilities in Large Language Models (LLMs) with Lakera's 2024 GenAI Security Readiness Report. This essential guide offers actionable insights to safeguard your AI systems from data leakage and other security threats. Equip yourself with the knowledge to protect your business in the evolving landscape of AI technology.,"[""LLM Security"", ""AI Vulnerabilities"", ""Data Protection"", ""GenAI"", ""AI Technology""]",12 Top LLM Security Tools: Paid & Free (Overview) | Lakera – Protecting AI teams that disrupt the world.,Discover 12 cutting-edge LLM security tools designed to protect Large Language Models from cyber threats & maintain integrity in evolving AI applications.,https://www.lakera.ai/blog/llm-security-tools
v7labs-com-blog-vision-transformer-guide.md,"Researchers, AI enthusiasts, data scientists, and professionals in the field of computer vision and machine learning.","[""The article introduces Vision Transformers (ViTs) as a competitive alternative to convolutional neural networks (CNNs) in computer vision tasks."", ""ViTs outperform CNNs in terms of both computational efficiency and accuracy."", ""Transformers, originally designed for natural language processing, have been adapted for vision tasks using a self-attention mechanism, allowing them to handle visual data differently compared to traditional CNNs."", ""The article covers the history of Transformers, highlighting a pivotal 2017 paper that introduced them to the broader AI community."", ""Key topics include the structure and functionality of Vision Transformers, their training processes, and real-world applications."", ""The article is designed to educate and inform readers about the potential of Vision Transformers in revolutionizing computer vision tasks.""]",2024-02-02,Deval,V7 Labs,Explore how Vision Transformers (ViTs) are revolutionizing computer vision. Discover their superior efficiency over traditional CNNs and learn about their applications and training methods. A must-read for those keen on cutting-edge AI innovations.,"[""Vision Transformers"", ""AI"", ""Computer Vision"", ""Deep Learning"", ""Machine Learning"", ""Technology""]",Vision Transformer: What It Is & How It Works [2024 Guide],A vision transformer (ViT) is a transformer-like model that handles vision processing tasks. Learn how it works and see some examples.,https://www.v7labs.com/blog/vision-transformer-guide
aporia-com-learn-reasoning-engine.md,"Tech enthusiasts, AI researchers, data scientists, and industry professionals interested in AI advancements.","[""The article explains what a reasoning engine is, likening it to a digital brain capable of processing information and making decisions based on logical rules."", ""It outlines the historical context, mentioning the Logic Theorist program and the development of expert systems in the AI field."", ""Different types of reasoning engines, including rule-based, semantic, probabilistic, and machine learning-based, are introduced, highlighting their functions and uses."", ""The advantages of reasoning engines, such as improved decision-making and efficiency, are discussed alongside challenges in their implementation."", ""The article emphasizes the ongoing evolution of reasoning engines and their integration with AI models to tackle complex problems.""]",2024-07-24,Deval,Aporia,"Discover the power of reasoning engines, the digital brains that revolutionize data processing and decision-making. Dive into their historical roots, understand their diverse types, and explore their role in enhancing AI capabilities. Whether it's a traffic control system or a complex AI model, reasoning engines are at the forefront of transforming industries with smart, efficient solutions. Uncover how these engines work and their promising future in the ever-evolving AI landscape.","[""AI"", ""Reasoning Engine"", ""Data Processing"", ""Expert Systems"", ""Decision-Making"", ""Technology"", ""Innovation""]",What is a Reasoning Engine and How Does It Work?,"A Reasoning Engine, aka a reasoner or rules engine, makes logical inferences based on rules and input data, guiding evaluations or recommending actions.",https://www.aporia.com/learn/reasoning-engine/
