article_markdown,target_audience,reasoning_steps,date_published,author,company,card_description,tags,title,description,source_url
lakera-ai-blog-reinforcement-learning-from-human-feedback.md,Tech professionals and organizations using AI technologies.,"[""The article provides insights into the 2024 GenAI Security Readiness Report by Lakera, which is critical for understanding the evolving landscape of AI security."", ""The report is designed to help organizations assess their current security measures and readiness against potential AI threats."", ""It offers detailed analysis and actionable recommendations to protect against vulnerabilities, especially in the context of Large Language Models (LLMs)."", ""The report highlights the importance of preparedness in the face of increasing reliance on AI models and the associated data privacy concerns."", ""It emphasizes the necessity of implementing robust security frameworks to safeguard sensitive information.""]",2024-01-01,Deval,Lakera,Unlock the secrets to safeguarding your AI systems with Lakera's GenAI Security Readiness Report 2024. Dive into expert insights on the most common vulnerabilities and learn how to fortify your defenses against emerging threats. Essential reading for anyone looking to protect their data and ensure AI integrity.,"[""AI Security"", ""GenAI"", ""LLM Vulnerabilities"", ""Data Protection"", ""Tech Trends 2024""]",Reinforcement Learning from Human Feedback (RLHF): Bridging AI and Human Expertise | Lakera – Protecting AI teams that disrupt the world.,"Learn how Reinforcement Learning from Human Feedback (RLHF) is revolutionizing AI. Discover how human input shapes AI behavior, ethics, and potential. Explore case studies and cutting-edge research.",https://www.lakera.ai/blog/reinforcement-learning-from-human-feedback
lakera-ai-blog-foundation-models-explained.md,"IT security professionals, AI researchers, tech enthusiasts, and business leaders seeking to enhance AI security measures.","[""Identify the subject of the article: Lakera's GenAI Security Readiness Report 2024."", ""Determine the purpose: To inform readers about security readiness in the context of Generative AI."", ""Extract key findings or highlights from the report to emphasize in the card."", ""Consider the implications of GenAI security readiness for various industries."", ""Analyze how this report will benefit the readers in understanding and mitigating AI-related risks.""]",2000-01-01,Deval,Lakera,Unlock the secrets to safeguarding your data with Lakera's cutting-edge GenAI Security Readiness Report 2024. This comprehensive guide reveals crucial insights into the vulnerabilities of Large Language Models (LLMs) and equips you with effective strategies to protect against potential data breaches. Stay ahead of the curve and ensure your systems are ready for the AI-driven future. Download now and fortify your defenses!,"[""Generative AI"", ""Security"", ""LLM vulnerabilities"", ""Data protection"", ""Technology"", ""Artificial Intelligence""]",Foundation Models Explained: Everything You Need to Know in 2023 | Lakera – Protecting AI teams that disrupt the world.,"Dive into Foundation models in machine learning: their workings, practical uses, limits, and adoption challenges.",https://www.lakera.ai/blog/foundation-models-explained
wevolver-com-article-urban-air-mobility-takes-off.md,"Urban planners, aviation enthusiasts, technology developers, and sustainability advocates interested in future urban transportation solutions.","[""Urban Air Mobility (UAM) is a cutting-edge concept focusing on transforming city transportation by using aircraft like air taxis and drones."", ""Key technological advancements in UAM are eVTOL (electric Vertical Take-Off and Landing) vehicles which offer environmental benefits and efficiency."", ""The growth of urban populations worldwide heightens the necessity for innovative transportation solutions, such as UAM, to alleviate congestion and provide efficient mobility."", ""Several major aviation companies, including Airbus and Volocopter, are pioneering UAM technologies, investing heavily in eVTOL air taxis."", ""The successful integration of UAM into urban areas depends on advanced air traffic management systems to ensure safety and efficiency."", ""Despite its potential, UAM's integration may not always lead to significant time savings compared to traditional travel methods, as studies in areas like Munich have indicated."", ""The potential for UAM to revolutionize urban transportation remains substantial, with a predicted increase in passenger drones by 2050."", ""Eve Air Mobility, among others, is actively establishing partnerships globally, focusing on the benefits of electrification in eVTOLs.""]",2000-01-01,Deval,Wevolver,"Imagine a city where drones and air taxis seamlessly navigate the skies, transforming urban transport into a swift, efficient, and eco-friendly experience. Urban Air Mobility (UAM) is not just a concept but an evolving reality, with nations like the U.S., Germany, and Japan at the forefront of its development. Dive into the world of eVTOLs and explore how innovations promise to redefine travel and logistics in bustling metropolises.","[""Urban Air Mobility"", ""eVTOL"", ""Air Taxis"", ""Drones"", ""Advanced Air Mobility""]",Urban Air Mobility Takes Off,"Exploring the potential of Urban Air Mobility (UAM) and electric Vertical Take-Off and Landing (eVTOL) vehicles in transforming urban transportation
",https://www.wevolver.com/article/urban-air-mobility-takes-off
aporia-com-learn-rag-in-production.md,Data Scientists and AI Engineers,"[""The article addresses the challenges organizations face when scaling RAG systems from prototypes to full-scale deployments."", ""It highlights key issues such as unexpected query patterns, retrieval mechanism strains, and latency problems."", ""The article provides a comprehensive strategy involving vector databases, LLM deployment, and API design to overcome these challenges."", ""Suggestions include using distributed vector databases, GPU-accelerated models, and efficient caching to improve performance."", ""The guide also covers the importance of managing latencies and using Kubernetes for system orchestration."", ""It emphasizes designing APIs with production resilience in mind and tailoring them to RAG-specific needs.""]",2024-09-02,Deval,Aporia,"Unlock the secrets to transforming Retrieval-Augmented Generation from concept to reality. Dive into action-packed strategies to tackle production hurdles like latency and query overload. Gain insights into cutting-edge deployment practices, from distributed databases to optimized retrieval pipelines. Perfect for anyone looking to scale their RAG systems seamlessly.","[""RAG"", ""AI Deployment"", ""Scalability"", ""Vector Databases"", ""Latency Management"", ""API Design"", ""Kubernetes""]",RAG in Production: Deployment Strategies & Practical Considerations,"As organizations rush to implement Retrieval-Augmented Generation (RAG) systems, many struggle at the production stage, their prototypes breaking under real-world scale.",https://www.aporia.com/learn/rag-in-production/
lakera-ai-blog-what-is-in-context-learning.md,Tech professionals and businesses utilizing Large Language Models (LLMs) for their operations.,"[""The article focuses on the 2024 GenAI Security Readiness Report released by Lakera, highlighting the evolving security challenges associated with Large Language Models (LLMs)."", ""It emphasizes the importance of understanding and mitigating the risks related to LLM vulnerabilities, such as data leakage and prompt injections."", ""The report serves as a resource for organizations and individuals relying on LLMs, offering strategies to enhance security and protect sensitive data."", ""The article aligns with Lakera's commitment to cybersecurity, providing insights into maintaining data integrity and privacy amidst growing reliance on AI technologies.""]",2000-01-01,Deval,Lakera,Uncover critical insights into the security landscape of Large Language Models (LLMs) with Lakera's GenAI Security Readiness Report 2024. This essential guide reveals common vulnerabilities and offers strategies to protect your data from potential breaches. Equip yourself with the knowledge to navigate AI-driven environments securely. Download now!,"[""GenAI"", ""Security"", ""LLM Vulnerabilities"", ""Data Protection"", ""AI Technology""]","What is In-context Learning, and how does it work: The Beginner’s Guide | Lakera – Protecting AI teams that disrupt the world.","Dive into In-context learning: its functioning, approaches, benefits, challenges, and real-world applications. Everything you need to know.",https://www.lakera.ai/blog/what-is-in-context-learning
wevolver-com-article-lorawan-wireless-condition-monitoring.md,"Industrial maintenance managers, manufacturing engineers, IoT specialists, and operations managers looking to optimize machinery performance and reduce downtime.","[""Condition Monitoring is a proactive maintenance strategy that uses real-time data to assess machinery health, focusing on key parameters like temperature and vibration."", ""It represents a shift from time-based maintenance, which schedules interventions at fixed intervals, to condition-based maintenance, which is driven by actual equipment conditions."", ""This approach enhances equipment reliability by allowing early detection of potential issues, reducing unexpected breakdowns."", ""It optimizes maintenance planning and resource allocation, leading to cost savings and improved machine longevity."", ""The process involves continuous monitoring of key parameters, data collection through sensors, and analysis to identify trends and anomalies."", ""This data-driven strategy not only improves safety by identifying potential hazards but also enhances overall equipment efficiency by maintaining optimal machine performance.""]",2000-01-01,Deval,Wevolver,"Unlock the future of industrial maintenance with Condition Monitoring, a game-changing strategy that leverages real-time data to optimize machinery performance. Discover how transitioning to condition-based maintenance can lead to cost savings, enhanced reliability, and improved safety by focusing on the actual condition of equipment rather than a fixed schedule.","[""IIoT"", ""IoT"", ""manufacturing systems"", ""Wi-Fi""]",LoRaWAN Wireless Condition Monitoring,"Condition Monitoring with LoRaWAN: A guide to its effectiveness in industrial maintenance, the transition from traditional methods, and overcoming implementation challenges",https://www.wevolver.com/article/lorawan-wireless-condition-monitoring
lakera-ai-blog-guide-to-prompt-injection.md,"IT professionals, security analysts, tech companies, and AI enthusiasts","[""The article provides insights into the importance of GenAI security readiness, emphasizing the potential vulnerabilities associated with large language models (LLMs)."", ""It highlights the risks of private data leakage when using LLMs, a growing concern as these models become integral to daily tasks."", ""The report offers a comprehensive guide on mitigating common LLM security risks, making it a valuable resource for organizations looking to safeguard their data."", ""The publication is timely, addressing current trends and challenges in AI security, and it serves as an essential tool for IT professionals, security analysts, and tech companies.""]",2024-01-01,Deval,Lakera,Unlock the secrets to safeguarding your data with Lakera's GenAI Security Readiness Report 2024. Dive deep into the world of Large Language Models (LLMs) and discover strategies to combat common vulnerabilities. Stay ahead of the curve and ensure your organization's security with our expert insights. Don't let your data be at risk—download now!,"[""GenAI Security"", ""Data Protection"", ""LLM Vulnerabilities"", ""Cybersecurity"", ""AI Technology""]","The ELI5 Guide to Prompt Injection: Techniques, Prevention Methods & Tools | Lakera – Protecting AI teams that disrupt the world.",Discover common prompt injection attacks and safeguard your AI applications. Learn about prevention techniques and tools in this article.,https://www.lakera.ai/blog/guide-to-prompt-injection
wevolver-com-article-revolutionizing-healthcare-the-profound-impact-of-tinyml-and-machine-learning-on-medical-outcomes.md,"Healthcare professionals, tech enthusiasts, medical researchers, and AI developers.","[""The article highlights the transformative role of TinyML and Machine Learning in healthcare, emphasizing their contribution to improving medical outcomes."", ""TinyML has made significant strides in wearable technology, with devices like the Oura ring and Apple Watch providing continuous health metrics."", ""One major advancement is the early detection of heart arrhythmias, which has increased detection rates by four times and potentially reduced hospital readmissions by 20%."", ""Machine Learning applications extend to broader healthcare practices, such as predictive analytics, enhanced imaging, and diagnostics, improving patient care."", ""Real-time data processing with ML algorithms, such as predicting sepsis hours before onset, is revolutionizing patient treatment and increasing survival rates."", ""ML also optimizes medication delivery by analyzing patient data for personalized dosages, reducing side effects and improving efficacy."", ""In ophthalmology, ML aids in diagnosing diabetic retinopathy by accurately analyzing retinal images, achieving a 90% diagnostic accuracy.""]",2000-01-01,Deval,wevolver,"Dive into the world of TinyML and Machine Learning in healthcare, where wearable technology is enhancing early detection of heart arrhythmias and reducing hospital readmissions. Discover how predictive analytics and real-time data processing are revolutionizing patient care, from tailored medication delivery to accurate diagnostics in diabetic retinopathy. Uncover the future of personalized healthcare today.","[""Artificial Intelligence"", ""Healthcare"", ""Machine Learning"", ""TinyML"", ""Wearable Technology""]",Revolutionizing Healthcare: The Profound Impact of TinyML and Machine Learning on Medical Outcomes,"Harnessing the Power of TinyML and Machine Learning: A Deep Dive into Modern Healthcare Innovations
",https://www.wevolver.com/article/revolutionizing-healthcare-the-profound-impact-of-tinyml-and-machine-learning-on-medical-outcomes
v7labs-com-blog-human-activity-recognition.md,"Researchers, developers, and enthusiasts in computer vision and AI, as well as professionals in healthcare, smart technology, and safety industries.","[""Human Activity Recognition (HAR) is a significant field within computer vision and human-computer interaction, focusing on the automatic detection and categorization of human physical activities."", ""HAR is important for improving human safety, well-being, and efficiency in various applications including health monitoring, smart homes, and personal safety devices."", ""The article covers the basics of HAR, including its definition, functionality, models, applications, and available datasets."", ""The use of sensors in HAR helps interpret human gestures and movements, which can be applied in numerous fields like healthcare, security, and athletic performance."", ""Several publicly available datasets make it easier for researchers and developers to engage with HAR without needing to collect data from scratch."", ""The article provides insights into current state-of-the-art methods, including deep learning and machine learning models suitable for HAR.""]",2023-03-27,Deval,V7 Labs,"Unlock the potential of Human Activity Recognition (HAR) to revolutionize safety, health, and home automation. Explore state-of-the-art models and datasets that facilitate the automatic detection of human activities, enhancing smart living and personal safety. Dive into the latest methods and applications that make HAR an essential tool for the future.","[""Human Activity Recognition"", ""Computer Vision"", ""AI Models"", ""Health Monitoring"", ""Smart Homes""]","Human Activity Recognition (HAR): Fundamentals, Models, Datasets",Dive into the state-of-the-art of Human Activity Recognition (HAR) and discover real-life applications plus datasets to try out.,https://www.v7labs.com/blog/human-activity-recognition
wevolver-com-article-steering-iot-innovation-in-global-asset-expeditions-and-fleet-journeys.md,"IoT developers, business leaders in logistics, and technology enthusiasts","[""The article discusses the increasing significance of global asset tracking and fleet management in the interconnected world economy."", ""It highlights the projected growth of the global asset tracking market from USD 15.9 billion in 2023 to USD 34.5 billion by 2032."", ""The integration of IoT technologies is a key driver of this growth, offering real-time visibility and enhanced asset control."", ""Challenges faced by industries include managing complex global supply chains, regulatory compliance, and cost reduction while ensuring asset security."", ""Particle is presented as a leader in the IoT space, offering innovative solutions for asset tracking and management."", ""IoT-supported asset tracking is expected to account for over 90% of all connected enterprise and industrial solutions by 2030."", ""The article emphasizes the use of technologies like RFID, GPS, and sensors to improve operational efficiency and compliance.""]",2000-01-01,Deval,Wevolver,"Discover how Particle's cutting-edge IoT solutions are revolutionizing global asset tracking and fleet management. With real-time data insights and enhanced asset control, businesses can navigate the complexities of global supply chains, reduce costs, and ensure regulatory compliance. Join the IoT innovation wave and transform your operations today.","[""IoT"", ""Asset Tracking"", ""Fleet Management"", ""Technology Innovation"", ""Global Supply Chain""]",Steering IoT Innovation in Global Asset Expeditions and Fleet Journeys,Discover how Particle's M-Series transforms global asset tracking and fleet management for improved efficiency and security.,https://www.wevolver.com/article/steering-iot-innovation-in-global-asset-expeditions-and-fleet-journeys
wevolver-com-article-unearthing-the-potential-of-precision-agriculture.md,"Farmers, agronomists, technology enthusiasts, environmentalists, and stakeholders in the agricultural sector.","[""Precision agriculture is a transformative approach that integrates technology into farming practices to enhance efficiency and sustainability."", ""By using tools like satellite imagery, weather predictions, and variable rate applications, precision agriculture optimizes resource allocation, minimizing environmental impact."", ""Core technologies include GIS, GPS, and remote sensing, which provide real-time data for decision-making, improving productivity and economic viability."", ""The article discusses the transition from traditional to precision agriculture, highlighting technological innovations and their future impact.""]",2000-01-01,Deval,Wevolver,"Unlock the future of farming with precision agriculture. Dive into how cutting-edge technologies and data-driven insights are revolutionizing crop management, enhancing efficiency, and reducing environmental footprints. Discover the innovations that are setting the stage for sustainable agriculture, ensuring both productivity and ecological balance. Join the movement towards smarter, data-centric farming today!","[""Agriculture"", ""IIoT"", ""IoT"", ""sensors"", ""Precision Agriculture""]",Unearthing the Potential of Precision Agriculture,"Explore the transformative power of precision agriculture, highlighting innovations like Particle's M-Series and the future of sustainable farming. Dive into the evolution, technologies, and trends shaping tomorrow's agriculture.",http://wevolver.com/article/unearthing-the-potential-of-precision-agriculture
wevolver-com-article-enhancing-quality-control-with-machine-vision-systems.md,"Manufacturing professionals, quality control specialists, and technology enthusiasts interested in automation and AI advancements.","[""Machine Vision Systems (MVS) are crucial in manufacturing for automating inspections and quality control."", ""They use cameras and computer algorithms to detect anomalies, ensuring high-quality standards."", ""MVS technology offers several benefits: improved accuracy, speed, efficiency, reduced human error, waste reduction, and cost savings."", ""AI, deep learning, and neural networks enhance MVS capabilities, enabling them to process and interpret complex visual data."", ""Different industries, such as electronics, pharmaceuticals, and automotive, leverage MVS for various inspection needs."", ""Future trends indicate further integration of AI technologies in MVS, enhancing their ability to adapt and learn.""]",2000-01-01,Deval,Wevolver,"Unlock the potential of Machine Vision Systems to revolutionize manufacturing quality control. Discover how AI and deep learning drive these systems to deliver unmatched accuracy and efficiency, reduce human error, and ensure consistent quality in industries like electronics, pharmaceuticals, and automotive.","[""artificial intelligence"", ""computer vision"", ""machine learning"", ""manufacturing systems""]",Enhancing Quality Control with Machine Vision Systems,"Transforming manufacturing processes through advanced inspection
",https://www.wevolver.com/article/enhancing-quality-control-with-machine-vision-systems
v7labs-com-blog-synthetic-data-guide.md,"Data scientists, machine learning engineers, and AI researchers looking to enhance model training with innovative data solutions.","[""**Understanding Synthetic Data**: Synthetic data refers to artificially generated data that mimics real-world patterns. It is used extensively in machine learning to overcome challenges associated with data collection, annotation, and quality assurance."", ""**Generation Techniques**: Popular techniques for generating synthetic data include Generative Adversarial Networks (GANs), Variational Autoencoders (VAEs), and Autoregressive models. These models create data that closely resembles the latent space of real-world data."", ""**Applications**: Synthetic data is primarily used in computer vision, involving RGB images, segmentation maps, and other sensory data forms like LiDAR and infrared images. It provides a cost-effective alternative to real data while ensuring diversity and accuracy."", ""**Challenges**: Despite its advantages, synthetic data presents challenges such as potential biases if not generated correctly and the need for extensive computational resources."", ""**Popular Datasets**: The article highlights various datasets and synthetic data generators that can be utilized to enhance the performance of machine learning models.""]",2022-06-05,Deval,V7 Labs,"Unlock the potential of synthetic data to supercharge your machine learning models. Discover how to generate high-quality, diverse datasets using cutting-edge techniques like GANs and VAEs. Explore its applications, challenges, and popular datasets to streamline your AI development process. Dive into the world of synthetic data and build better AI faster.","[""Synthetic Data"", ""Machine Learning"", ""Data Generation"", ""Computer Vision"", ""AI Development""]",What is Synthetic Data in Machine Learning and How to Generate It,What is synthetic data and how to generate and use it for training your machine learning models? Explore popular datasets and synthetic data generators to build better AI faster.,https://www.v7labs.com/blog/synthetic-data-guide
wevolver-com-article-enhancing-battery-health-with-machine-learning.md,Engineers and tech enthusiasts interested in battery technology and machine learning.,"[""The importance of battery health has increased with the rise of electric vehicles (EVs) and industrial applications relying on batteries."", ""Battery health, known as the state of health (SoH), is a crucial measure influencing the performance and longevity of batteries."", ""Degradation of battery health can lead to frequent recharging and reduced efficiency."", ""Machine learning offers a solution to monitor and enhance battery health by analyzing data and predicting battery performance."", ""Real-time data analysis using machine learning can lead to more accurate predictions of battery lifespan."", ""Anomaly detection with machine learning helps in identifying potential issues and addressing them proactively."", ""Predictive maintenance can minimize downtime by scheduling battery servicing at opportune times.""]",2000-01-01,Deval,Wevolver,"Unlock the potential of your electric vehicle's battery with cutting-edge machine learning technology. Discover how real-time data analysis can predict battery life, enhance efficiency, and prevent unexpected failures. Stay ahead with innovative solutions for smarter battery management.","[""battery management system (BMS)"", ""Edge AI"", ""edge processors"", ""machine learning""]",Enhancing Battery Health with Machine Learning,Edge AI platforms can assist engineers to monitor battery health systems.,https://www.wevolver.com/article/enhancing-battery-health-with-machine-learning
