article_markdown,target_audience,reasoning_steps,date_published,author,company,card_description,tags,title,description,source_url
lakera-ai-blog-responsible-ai.md,"Technology professionals, cybersecurity experts, and business leaders interested in AI security and data protection.","[""The article introduces Lakera's GenAI Security Readiness Report for 2024, providing insights into the current state of AI security."", ""The report highlights the growing importance of securing Large Language Models (LLMs) against vulnerabilities and data breaches."", ""It emphasizes the necessity for businesses to adapt and prepare for evolving AI threats, ensuring data protection and compliance."", ""Key findings from the report include common security risks associated with LLMs and actionable strategies to mitigate them."", ""The article stresses the importance of staying informed about AI security trends to safeguard organizational and personal data.""]",2024-01-01,Deval,Lakera AI,Unlock the future of AI security with Lakera's latest report. Discover the vulnerabilities facing Large Language Models and the strategies you need to protect your data in 2024. Equip your organization with the knowledge to navigate evolving AI threats efficiently and securely. Don't let your data be at risk—download the GenAI Security Readiness Report today!,"[""AI Security"", ""Large Language Models"", ""Data Protection"", ""Cybersecurity"", ""GenAI Report""]",Embracing the Future: A Comprehensive Guide to Responsible AI | Lakera – Protecting AI teams that disrupt the world.,"Explore the essentials of Responsible AI, focusing on ethical and safe AI use in technology.",https://www.lakera.ai/blog/responsible-ai
v7labs-com-blog-few-shot-learning-guide.md,"AI researchers, machine learning enthusiasts, data scientists, and professionals in computer vision.","[""Identify the key concepts discussed in the article: Few-Shot Learning, its definition, working mechanism, image classification algorithms, applications, and relevant research papers."", ""Understand the importance of Few-Shot Learning: It allows AI models to learn from fewer examples, overcoming the limitation of requiring large datasets."", ""Highlight the tools and resources offered by V7: Annotation tools, model training, dataset management, and automated annotation services."", ""Consider the potential audience: AI researchers, machine learning enthusiasts, data scientists, and professionals in computer vision.""]",2022-06-13,Deval,V7 Labs,"Unlock the potential of AI with Few-Shot Learning, a revolutionary technique that enables models to learn from minimal data. Dive into our comprehensive guide to understand its workings, discover cutting-edge applications, and explore the tools to train your AI models efficiently. Transform your approach to machine learning and stay ahead in the data-driven world.","[""Few-Shot Learning"", ""Machine Learning"", ""AI Models"", ""Data Annotation"", ""Computer Vision""]",A Step-by-step Guide to Few-Shot Learning,"What is Few-Shot Learning, how does it work and what are its most prominent applications? Read this beginner's guide to Few-Shot Learning and start training reliable AI models with V7 today.",https://www.v7labs.com/blog/few-shot-learning-guide
aporia-com-learn-top-genai-security-tools.md,"Tech companies, AI developers, IT security professionals, and business leaders interested in AI security solutions.","[""The article highlights seven GenAI security tools that are essential for businesses looking to safeguard their AI applications."", ""Each tool is evaluated based on its unique features and strengths, offering readers a comprehensive overview of their options."", ""Aporia is noted for its end-to-end security capabilities, while Lakera Guard is specialized in handling cyber security threats."", ""Calypso AI is focused on governance, ensuring that generative AI models adhere to regulations and compliance."", ""Lasso Security excels in contextual data protection, providing real-time alerts and seamless integration."", ""WhyLabs offers continuous monitoring, ensuring that any potential security threats are detected promptly."", ""Protect AI provides customizable security solutions, catering to enterprises with its AI Security Posture Management."", ""LLM Guard stands out for its cost-effective CPU inference and built-in data protections."", ""The article provides a comparison table that further breaks down the key features of each tool, helping businesses decide which tool best fits their needs.""]",2024-07-24,Deval,Aporia,"Explore the top 7 GenAI security tools that are revolutionizing AI protection. From end-to-end security to cost-effective solutions, discover how to shield your AI applications from threats and ensure compliance. This guide helps you choose the right tool to keep your AI assets safe and your business ahead.","[""GenAI"", ""Security Tools"", ""AI Safety"", ""AI Governance"", ""Data Protection"", ""Cyber Security"", ""Continuous Monitoring""]",Top 7 GenAI Security Tools to Safeguard Your AI Future,Get a comprehensive list of the top AI security tools in 2024. These tools will help you safeguard your system from potential threats.,https://www.aporia.com/learn/top-genai-security-tools/
wevolver-com-article-harnessing-the-okdo-nano-c100-developer-kit-for-leukemia-classification.md,"Developers and researchers in the medical AI field, healthcare technology professionals, and AI enthusiasts interested in medical diagnostics.","[""The OKdo Nano C100 Developer Kit is a versatile tool for medical diagnostics, specifically for leukemia classification, due to its robust processing capabilities powered by the NVIDIA Jetson Nano Module."", ""Its affordability and compatibility with the NVIDIA ecosystem make it accessible for developers and researchers in the AI and medical fields."", ""The developer kit is equipped with a 128-core NVIDIA Maxwell GPU and a Quad-core ARM A57 CPU, providing the necessary computational power for complex AI workloads."", ""The kit features extensive input/output options, including various ports and connectors, enhancing its versatility for integrating multiple sensors and devices, crucial for medical imaging and diagnostics."", ""Its power efficiency, consuming as little as 5 watts, makes it suitable for prolonged use in data-intensive medical applications."", ""The support of NVIDIA JetPack, which includes essential software libraries, simplifies the development process, making it easier to build advanced AI models for leukemia classification.""]",2023-10-15,Deval,Wevolver,"Transform medical diagnostics with the OKdo Nano C100 Developer Kit. Harness the power of AI for precise leukemia detection using NVIDIA technology, offering a cost-effective, robust, and power-efficient solution for advanced healthcare applications.","[""Artificial Intelligence"", ""Medical Devices"", ""Microchips"", ""Sensors""]",Harnessing the OKdo Nano C100 Developer Kit for Leukemia Classification,Optimizing Medical AI: Revolutionizing Diagnostics with the OKdo Nano C100 Developer Kit,https://www.wevolver.com/article/harnessing-the-okdo-nano-c100-developer-kit-for-leukemia-classification
v7labs-com-blog-pytorch-loss-functions.md,Developers and data scientists interested in deep learning and AI model optimization using PyTorch.,"[""Understanding the role of loss functions in deep learning is crucial as they act as feedback mechanisms, highlighting the errors in model predictions and guiding the learning process towards more accurate outcomes."", ""The article explains the setup of PyTorch, a popular deep learning framework, and details how to define various loss functions within this environment."", ""It explores multiple predefined loss functions available in PyTorch and their appropriate use cases, ensuring readers can select the suitable one for their specific model training tasks."", ""The article also delves into creating custom loss functions in PyTorch, providing flexibility for developers to tailor functions according to unique requirements."", ""Monitoring and adjusting loss functions during the training process is emphasized to continuously improve model performance."", ""Finally, the article summarizes the importance and application of PyTorch loss functions, providing a comprehensive guide for practitioners.""]",2022-07-13,Deval,V7 Labs,"Unlock the power of PyTorch with an in-depth dive into loss functions. Master how to set up, define, and monitor these critical components to enhance your deep learning models. Whether using predefined functions or creating custom ones, learn to optimize your model's performance effectively. Perfect for developers and data scientists eager to refine their AI solutions.","[""PyTorch"", ""Loss Functions"", ""Deep Learning"", ""AI"", ""Machine Learning""]",The Essential Guide to Pytorch Loss Functions,"In this article, we will go in-depth about the loss functions and their implementation in the PyTorch framework.",https://www.v7labs.com/blog/pytorch-loss-functions
wevolver-com-article-matter-the-future-of-smart-home-connectivity-and-its-impact-on-product-development.md,"Engineers, developers, tech enthusiasts, and product designers focused on IoT and smart home technologies.","[""The article introduces the Matter protocol, a significant advancement in smart home connectivity, aiming to standardize communication among devices to enhance user experience."", ""It highlights that Matter is backed by tech giants like Amazon, Google, and Apple, which underscores its potential as the new standard for smart home connectivity."", ""The protocol addresses the challenge of device interoperability in the smart home ecosystem, providing a unified communication standard that supports seamless device interaction."", ""Matter's adoption by major companies is expected to expedite its market penetration and stimulate the growth of smart home devices."", ""The article emphasizes the transformative impact of Matter on IoT product development, simplifying the process and enabling faster innovation."", ""The Connectivity Standards Alliance (CSA), formerly Zigbee Alliance, is the body responsible for maintaining the Matter standard, aiming to enhance device compatibility and security."", ""Matter allows devices to operate locally and connect to the cloud, improving product functionality and security across different manufacturer platforms.""]",2023-10-01,Deval,Wevolver,"Unlock the potential of the Matter protocol, the groundbreaking standard revolutionizing smart home connectivity. Discover how Matter simplifies device interoperability, accelerates IoT product development, and enhances user experiences. Backed by tech giants like Amazon, Google, and Apple, Matter is set to become the cornerstone of the smart home ecosystem. Dive into its transformative impact on product design and development, and explore the future of seamless smart home connectivity.","[""IoT"", ""product design"", ""smart home""]",Matter: The Future of Smart Home Connectivity and Its Impact on Product Development,"Understanding Matter's role in standardizing smart home communication, endorsed by industry leaders and aimed at transforming IoT product development by addressing device compatibility issues.
",https://www.wevolver.com/article/matter-the-future-of-smart-home-connectivity-and-its-impact-on-product-development
lakera-ai-blog-ai-red-teaming.md,"Business leaders, IT professionals, and cybersecurity experts involved in AI deployment.","[""The article presents Lakera's newly released GenAI Security Readiness Report for 2024, a crucial document for businesses leveraging AI in their operations."", ""The report highlights the importance of understanding and mitigating security risks associated with large language models, especially as their use becomes more prevalent."", ""The report emphasizes in-context learning and the security vulnerabilities it may present, urging businesses to be aware and proactive in their AI integrations."", ""It includes practical advice and strategies for safeguarding sensitive data from potential leaks via AI models."", ""The report is positioned as an essential resource for companies aiming to future-proof their AI implementations against potential security threats.""]",2024-01-01,Deval,Lakera AI,Unlock the secrets to secure AI usage with Lakera's GenAI Security Readiness Report 2024. Navigate LLM vulnerabilities with confidence and protect your data with this comprehensive guide. Equip your business with the strategies you need to mitigate risks and ensure robust AI deployment.,"[""AI Security"", ""Large Language Models"", ""Data Privacy"", ""Risk Mitigation"", ""Lakera AI"", ""Security Report""]",AI Under Siege: Red-Teaming Large Language Models | Lakera – Protecting AI teams that disrupt the world.,"Learn how red-teaming techniques like jailbreak prompting enhance the security of large language models like GPT-3 and GPT-4, ensuring ethical and safe AI deployment.",https://www.lakera.ai/blog/ai-red-teaming
lakera-ai-blog-guide-to-hallucinations-in-large-language-models.md,"Tech companies, AI developers, cybersecurity professionals, and data privacy advocates.","[""The article introduces Lakera's GenAI Security Readiness Report 2024, a valuable resource for businesses and developers working with Generative AI technologies."", ""The report aims to address prevailing security challenges in the field of Large Language Models (LLMs), providing insights into common vulnerabilities."", ""There is an emphasis on data protection, focusing on the risks of private data leakage associated with the use of LLMs."", ""The article highlights the importance of understanding these risks to bolster security measures and protect sensitive information."", ""Additionally, the content touches upon cookie consent and the importance of user permission for enhanced user experience on websites.""]",2000-01-01,Deval,Lakera,Unlock the secrets to safeguarding your Generative AI systems with Lakera's GenAI Security Readiness Report 2024. Gain deep insights into the most common vulnerabilities in Large Language Models and learn effective strategies to ensure your data remains secure. Delve into this essential guide and stay ahead in the rapidly evolving AI landscape.,"[""AI Security"", ""LLM Vulnerabilities"", ""Data Protection"", ""Generative AI"", ""Technology Insights""]",The Beginner’s Guide to Hallucinations in Large Language Models | Lakera – Protecting AI teams that disrupt the world.,"Dive into LLM hallucinations, their causes, impacts on trust & security, and mitigation techniques. Discover the future of AI safety and ethics.",https://www.lakera.ai/blog/guide-to-hallucinations-in-large-language-models
lakera-ai-blog-training-data-poisoning.md,"Technology professionals, cybersecurity experts, AI enthusiasts, and business leaders","[""The article highlights the importance of being prepared for security risks associated with Generative AI models."", ""It emphasizes the release of Lakera's GenAI Security Readiness Report 2024."", ""The report is designed to help organizations understand and mitigate risks posed by Generative AI technologies."", ""The use of cookies on the Lakera website is explained, emphasizing the importance of user consent for non-essential cookies."", ""A brief guide on protecting against common vulnerabilities in Large Language Models (LLMs) is mentioned."", ""The importance of learning about LLM security as these models become more integrated into daily tasks is underlined.""]",2024-01-01,Deval,Lakera,Unlock the secrets to safeguarding your organization against GenAI threats with Lakera's GenAI Security Readiness Report 2024. This comprehensive guide provides actionable insights and strategies to equip you with the knowledge to protect sensitive data and navigate the evolving landscape of AI security. Download now to stay ahead in the realm of AI safety and innovation!,"[""GenAI"", ""Security"", ""AI"", ""Technology"", ""Data Protection"", ""Lakera""]",Introduction to Training Data Poisoning: A Beginner’s Guide | Lakera – Protecting AI teams that disrupt the world.,Learn about data poisoning's effect on Large Language Models and strategies to protect AI systems' reliability and safety.,https://www.lakera.ai/blog/training-data-poisoning
wevolver-com-article-exploring-the-frontier-of-edge-ai-top-5-single-board-computers-sbcs.md,"Tech enthusiasts, IT professionals, and industry leaders interested in AI, IoT, and cutting-edge technology solutions.","[""The article begins by discussing the shift from centralized cloud processing to Edge AI, emphasizing the benefits such as reduced latency, enhanced privacy, and improved operational efficiency."", ""Edge AI enables real-time data processing on devices like smartphones and IoT sensors, fostering independent decision-making without relying on cloud connectivity."", ""The article highlights the role of Single Board Computers (SBCs) in Edge AI, noting their compact and efficient design, which makes them ideal for edge computing applications."", ""SBCs allow AI algorithms to run locally, reducing latency and enhancing the responsiveness of applications, especially in time-sensitive scenarios like autonomous vehicles and emergency systems."", ""The article discusses the economic and privacy advantages of SBCs, as they reduce bandwidth costs and enhance data security by processing information locally."", ""It concludes by exploring the future trends in Edge AI and SBCs, suggesting that these technologies will continue to evolve and transform various industries by enabling more autonomous applications.""]",2000-01-01,Deval,Wevolver,"Discover how Edge AI is revolutionizing industries by enabling real-time data processing directly on devices, reducing latency, and enhancing privacy. Learn about the top Single Board Computers (SBCs) driving this transformation, offering compact, efficient solutions for smarter applications. Whether in autonomous vehicles or smart homes, these innovations are paving the way for a more connected and responsive future. Dive into the criteria for selecting the best SBCs and explore future trends in Edge AI, setting the stage for the next wave of technological advancements.","[""Edge AI"", ""Single Board Computers"", ""Real-time Processing"", ""Latency Reduction"", ""IoT"", ""Privacy"", ""Autonomous Vehicles""]",Exploring the Frontier of Edge AI: Top 5 Single Board Computers (SBCs),Dive into the future of Edge AI with an in-depth look at the top 5 AI Single Board Computers shaping tomorrow's tech. ,https://www.wevolver.com/article/exploring-the-frontier-of-edge-ai-top-5-single-board-computers-sbcs
lakera-ai-blog-reinforcement-learning.md,"Tech leaders, security professionals, AI developers, and businesses leveraging AI technology","[""Lakera has released its 2024 GenAI Security Readiness Report, providing insights into the latest advancements and safety measures in AI technology."", ""The report highlights the importance of security in the rapidly evolving field of Generative AI, which is becoming increasingly integral to a variety of industries."", ""Key vulnerabilities and potential risks associated with large language models (LLMs) are identified, helping organizations understand where they might be exposed to threats."", ""Practical strategies and methodologies are suggested to safeguard personal and organizational data from these vulnerabilities."", ""The report is a valuable resource for tech companies, security professionals, and businesses looking to enhance their AI security protocols.""]",2024-01-01,Deval,Lakera,Unlock the latest insights into AI security with Lakera's 2024 GenAI Security Readiness Report. Discover key vulnerabilities in large language models and learn proactive strategies to secure your data. Essential reading for tech leaders and security professionals.,"[""AI Security"", ""Generative AI"", ""LLM Vulnerabilities"", ""Data Protection"", ""Tech Industry"", ""Cybersecurity""]",Reinforcement Learning: The Path to Advanced AI Solutions | Lakera – Protecting AI teams that disrupt the world.,"Explore Reinforcement Learning (RL), the AI breakthrough based on interactive learning for decision-making. Discover its applications in gaming, robotics, healthcare, and more.",https://www.lakera.ai/blog/reinforcement-learning
aporia-com-learn-top-challenges-enterprise-llm-applications.md,"Business leaders, AI developers, and enterprise technology strategists.","[""Understand the core challenges LLMs face in enterprise applications: data quality, resource intensity, domain-specific fine-tuning, scalability, and UX."", ""Identify the importance of diverse and accurate datasets for reliable LLM outputs."", ""Explain how the resource-intensive nature of LLM training affects implementation costs and suggest optimization strategies."", ""Emphasize the need for domain-specific fine-tuning to adapt LLMs for industry-specific tasks."", ""Discuss scalability challenges and the need for distributed computing and performance optimization to meet real-time demands."", ""Highlight the role of user experience in ensuring the adoption and success of LLM applications.""]",2024-08-20,Deval,Aporia,"Unlock the full potential of Large Language Models (LLMs) in your enterprise by tackling the critical challenges of data quality, resource management, and scalability. Discover strategic insights into fine-tuning models for specific industry needs and the pivotal role of UX in driving adoption. Enhance your business operations with LLMs by understanding and overcoming these hurdles.","[""LLM"", ""Enterprise Applications"", ""Data Quality"", ""Model Training"", ""Scalability"", ""UX Design""]",Top Challenges in Building Enterprise LLM Applications,This comprehensive guide explores organizations' key challenges when building enterprise LLM applications.,https://www.aporia.com/learn/top-challenges-enterprise-llm-applications/
wevolver-com-article-intelligence-at-scale-through-ai-model-efficiency.md,"Tech industry professionals, AI developers, environmental sustainability advocates, and business leaders interested in AI advancements.","[""AI models are becoming increasingly complex, leading to efficiency challenges."", ""The growth of digital data is not keeping pace with the rapid expansion of AI models."", ""AI's energy consumption is a significant concern, contributing to environmental issues like increased greenhouse gas emissions."", ""Efficient AI models are crucial for sustainable development, particularly in sectors like autonomous vehicles, healthcare, and IoT."", ""Qualcomm is at the forefront of optimizing AI for efficiency, focusing on edge devices to reduce energy consumption.""]",2000-01-01,Deval,wevolver-com,"Unlock the potential of AI with a focus on efficiency. Discover how optimizing model performance can revolutionize sectors from autonomous vehicles to IoT, while minimizing environmental impact. Explore Qualcomm's pioneering efforts in AI model scaling and efficiency, crucial for sustainable technological advancements.","[""artificial intelligence"", ""Edge AI"", ""efficiency"", ""sustainability"", ""Qualcomm""]",Intelligence at Scale Through AI Model Efficiency,"Optimizing AI for the Future: Model Efficiency and Scalability
",https://www.wevolver.com/article/intelligence-at-scale-through-ai-model-efficiency
wevolver-com-article-qoitech-for-power-analysis-and-battery-optimisation.md,"Engineers, developers, and electronics designers focused on power optimization and energy-efficient solutions.","[""The article centers on the significance of power analysis in electronic design, a crucial aspect for enhancing energy efficiency in devices."", ""It introduces the Qoitech Otii Arc Pro DC Power Analyzer as a solution for engineers to optimize power usage and improve battery life."", ""The article discusses advancements in Electronic Design Automation (EDA) and power delivery networks (PDNs) as factors increasing the need for sophisticated power analysis tools."", ""The Qoitech Otii Arc Pro is highlighted for its precision, providing real-time insights into device power usage to identify inefficiencies."", ""The device's compact design allows for portability, making it suitable for various environments, including labs and field measurements."", ""With features like a wide measurement range and compatibility with major operating systems, the Otii Arc Pro is positioned as a versatile tool for developers.""]",2000-01-01,Deval,Wevolver,"Unleash the full potential of your electronic designs with the Qoitech Otii Arc Pro. This compact powerhouse offers real-time power analysis and battery optimization, essential for creating energy-efficient, high-performance devices. Discover how advanced tools like the Otii Arc Pro are revolutionizing the way engineers and developers approach power management in modern technology.","[""Battery life"", ""Electronics"", ""Product design"", ""Single board computer""]",Qoitech for power analysis and battery optimisation,"Discover the Qoitech Otii Arc Pro, the ultimate power analysis tool for enhancing device energy efficiency. Learn how its precision, user-friendly interface, and unique battery optimization features can transform your electronic design and development projects for the better.",https://www.wevolver.com/article/qoitech-for-power-analysis-and-battery-optimisation
