article_markdown,target_audience,reasoning_steps,date_published,author,company,card_description,tags,title,description,source_url
wevolver-com-article-ensuring-the-safety-of-fur-babies-the-role-of-gnss-in-advanced-pet-trackers.md,Pet owners and tech enthusiasts interested in advanced tracking solutions for animal safety.,"[""The article emphasizes the importance of GNSS technology in modern pet trackers, highlighting its role in alleviating concerns about lost pets."", ""GNSS technology utilizes a comprehensive network of satellites, control stations, and receivers to provide precise location data, making it a reliable choice for pet tracking."", ""The historical context, from Sputnik 1 to modern satellite navigation systems like GPS, GLONASS, Galileo, and BeiDou, shows the evolution of location tracking technology."", ""The u-blox M10 platform is spotlighted as a key innovation, known for its low power consumption and suitability for compact applications such as pet trackers."", ""The platform's features like high update rates, dynamic accuracy, and superior RF sensitivity make it ideal for ensuring pet safety."", ""The article outlines the transition from RFID to GPS in pet tracking, noting the technological advancements that have made devices more compact and efficient.""]",2023-10-10,Deval,Wevolver,"Keep your furry friends safe and secure with cutting-edge GNSS technology in advanced pet trackers. Discover how the u-blox M10 platform ensures high-precision tracking, offering peace of mind for pet owners. Explore the evolution from RFID to GPS, and learn how modern innovations are revolutionizing pet safety and tracking. Don't let your pet get lost in the crowd; stay connected and informed with the latest in pet tracking technology.","[""GNSS"", ""pet safety"", ""u-blox M10"", ""tracking technology"", ""satellite navigation"", ""pet tracker innovation""]",Ensuring the Safety of Fur Babies: The Role of GNSS in Advanced Pet Trackers,"Explore how GNSS technology, powered by the u-blox M10 platform, offers pet safety with high-precision, low-energy tracking solutions for our furry friends.
",https://www.wevolver.com/article/ensuring-the-safety-of-fur-babies-the-role-of-gnss-in-advanced-pet-trackers
aporia-com-learn-vector-databases.md,"Tech enthusiasts, AI developers, data scientists, and anyone interested in the future of AI technology.","[""Vector databases are specialized systems designed to efficiently store, manage, and query vector embeddings."", ""They have become essential in generative AI applications because they facilitate fast similarity search and retrieval, making complex computations like clustering and recommendations possible."", ""The concept dates back to Tomas Mikolov's work on word2vec in 2013, showing the historical evolution."", ""They differ from traditional databases by focusing on high-dimensional data representations, which are crucial for AI applications like NLP, image processing, and autonomous vehicles."", ""Popular vector databases include Pinecone, Milvus, Weaviate, and Qdrant, each offering unique features."", ""Future developments may see vector databases integrating with graph databases and supporting real-time data processing.""]",2024-08-11,Deval,Aporia,"Unlock the secrets behind generative AI's power with vector databases. Discover how these specialized systems are transforming AI applications by efficiently managing high-dimensional data, enabling rapid similarity searches, and driving innovations in NLP, image processing, and more. Dive into the future of AI technology today!","[""Vector Databases"", ""Generative AI"", ""AI Technology"", ""Data Management"", ""NLP"", ""Image Processing""]",Vector Databases: Powering the Future of Generative AI | Aporia,"Discover why vector databases are crucial for generative AI. Learn about their features and applications in NLP, image processing, and autonomous vehicles.",https://www.aporia.com/learn/vector-databases/
wevolver-com-article-neuromorphic-e-noses-in-medical-and-industrial-applications.md,"Researchers and professionals in AI, medical diagnostics, and industrial applications seeking advanced solutions for sensory technology challenges.","[""The article discusses the advancements in e-nose technology, focusing on the neuromorphic approach using spiking neural networks to improve portability, energy efficiency, and accuracy of these devices."", ""It highlights the significance of the 'bacteria in blood' dataset from the Mednose project, which is crucial for early detection and diagnosis of bacterial infections through unique chemical signatures."", ""The dataset undergoes preprocessing to remove noise and uses innovative encoding algorithms like AERO and SF to convert sensor data into digital formats, facilitating improved analysis and classification."", ""The Akida\u2122 classifier model achieves a high accuracy of 97.42% in identifying bacteria, showcasing the potential of neuromorphic computing in enhancing e-nose capabilities for medical diagnostics.""]",2000-01-01,Deval,Wevolver,"Unlock the potential of neuromorphic computing with our breakthrough in electronic nose technology, designed to revolutionize medical diagnostics and industrial applications. By leveraging spiking neural networks and innovative encoding algorithms, our solution enhances accuracy and efficiency, paving the way for timely and precise bacterial detection.","[""artificial intelligence"", ""edge processors"", ""sensors"", ""neuromorphic computing"", ""medical diagnostics"", ""e-noses""]",Neuromorphic E-Noses in Medical and Industrial Applications,"Exploring the Fusion of Neuromorphic Computing and Electronic Noses for Advanced Sensory Solutions
",https://www.wevolver.com/article/neuromorphic-e-noses-in-medical-and-industrial-applications
wevolver-com-article-leveraging-low-power-embedded-computer-vision-to-solve-urgent-sustainability-and-safety-challenges.md,"Technology enthusiasts, environmentalists, urban planners, and professionals in public safety and transportation sectors.","[""The article focuses on leveraging low-power embedded computer vision technology to address pressing sustainability and safety challenges."", ""It highlights the role of edge computing and real-time data analytics in achieving the United Nations' Sustainable Development Goals (SDGs)."", ""One example given is the use of pedestrian tracking systems to enhance public safety by preventing pedestrian fatalities through intelligent traffic control."", ""Another application discussed is the reduction of greenhouse gas emissions in air travel by using computer vision to monitor and manage aircraft idling times."", ""The article also mentions the use of smart traps to control invasive species and maintain ecological balance, aligning with environmental conservation goals.""]",2000-01-01,Deval,Wevolver,"Unlock the potential of low-power embedded computer vision to transform urban safety and environmental sustainability. Discover how this innovative technology can prevent pedestrian fatalities, reduce aircraft emissions, and maintain ecological balance by controlling invasive species. Explore real-world applications that align with the United Nations' Sustainable Development Goals and drive impactful change in our communities.","[""Artificial Intelligence"", ""Embedded Systems"", ""Sustainability"", ""Public Safety"", ""Environmental Conservation""]",Leveraging low-power embedded computer vision to solve urgent sustainability and safety challenges,"Low-power computer vision provides a new opportunity to gain a practical understanding of the world through data collection and vision in remote areas.
",https://www.wevolver.com/article/leveraging-low-power-embedded-computer-vision-to-solve-urgent-sustainability-and-safety-challenges
wevolver-com-article-balancing-the-cloud-and-the-edge-a-close-look-at-enabling-hybrid-ai.md,"Technology enthusiasts, AI developers, and industry professionals interested in AI, edge computing, and cutting-edge innovations in data processing.","[""The article focuses on the evolution of AI technologies, highlighting the significance of hybrid AI solutions in scaling generative AI technologies."", ""It discusses Qualcomm\u2019s role in leading this transformation by developing on-device Generative AI, which bridges the gap between cloud-based AI and real-time computations on edge devices."", ""The whitepaper by Qualcomm emphasizes the hybrid AI architecture, which balances processing between the cloud and devices, offering cost efficiency, enhanced performance, privacy, and security."", ""Qualcomm is noted for its industry-leading hardware solutions that offer superior performance metrics, particularly in mobile solutions."", ""The company\u2019s full-stack AI optimization strategy ensures its competitiveness in on-device AI solutions, with a focus on transparency, fairness, and user privacy."", ""Collaboration with developers and ISVs allows Qualcomm to enhance AI applications across various devices, showing its commitment to ecosystem enablement.""]",2000-01-01,Deval,Wevolver,"Discover how hybrid AI solutions are revolutionizing data processing by balancing cloud computational power with real-time edge-device capabilities. Qualcomm spearheads this transformation with pioneering on-device Generative AI technologies, enhancing performance, privacy, and energy efficiency across a wide array of devices.","[""artificial intelligence"", ""Edge AI"", ""Low power consumption"", ""hybrid AI"", ""Qualcomm""]",Balancing the Cloud and the Edge: A Close look at Enabling Hybrid AI,"Qualcomm's Pioneering Approach to Hybrid AI: Merging Cloud Processing with On-Device Efficiency and Scale
",https://www.wevolver.com/article/balancing-the-cloud-and-the-edge-a-close-look-at-enabling-hybrid-ai
aporia-com-learn-evolution-of-rag-in-generative-ai.md,"AI researchers, technology enthusiasts, data scientists, and professionals interested in AI advancements.","[""Identify key components of RAG (Retrieval Augmented Generation) which include the integration of external data sources to enhance the capabilities of generative AI."", ""Discuss the foundational aspects of RAG, which involve its ability to provide non-parametric memory to LLMs, allowing them to reference and use vast knowledge bases."", ""Highlight the introduction of RAG by Meta AI in 2020, emphasizing its role in enhancing generative models with accurate and contextually rich information."", ""Explain the mechanism of RAG, which involves utilizing dense vector indices from factual databases such as Wikipedia to retrieve pertinent information during the generation process."", ""Outline the benefits of RAG, which improve the contextual richness, accuracy, and factual consistency of the AI-generated content."", ""Discuss the challenges traditional generative AI models face, such as the inefficiency in updating their knowledge base due to computational costs, which RAG addresses effectively."", ""Explore the future research directions and potential advancements RAG could bring to generative AI technologies.""]",2024-07-04,Deval,Aporia,"Explore how Retrieval Augmented Generation (RAG) revolutionizes generative AI by overcoming the static knowledge limitations of traditional models. Discover how RAG's integration of external data sources provides non-parametric memory to enhance AI's accuracy and contextual understanding, paving the way for future advancements in AI technology.","[""Generative AI"", ""RAG"", ""Artificial Intelligence"", ""Technology"", ""Innovation""]",Understanding the Evolution of RAG in Generative AI,"These models extract relevant information from a knowledge base to respond to queries. Yet, they may lack the creative flair and coherence of generative models.",https://www.aporia.com/learn/evolution-of-rag-in-generative-ai/
wevolver-com-article-seeed-studio-recomputer-industrial-ai-devices-for-engineers.md,Engineers and industrial sector professionals looking to integrate AI solutions into their operations.,"[""The article focuses on the integration of AI in industrial sectors through Seeed Studio's new ReComputer Industrial series."", ""These devices incorporate advanced NVIDIA technologies for high AI computational performance, ranging from 20 TOPS to 100 TOPS."", ""The ReComputer series is designed for industrial adaptability, featuring a fanless construction to withstand extreme conditions."", ""These devices are equipped with NVIDIA Jetson Xavier NX, Orin Nano, or Orin NX modules, making them capable of handling complex AI tasks."", ""The article highlights the technical specifications, including the operating temperature range and various industry-standard interfaces for connectivity."", ""ReComputer Industrial series devices are compliant with industry certifications like FCC, CE, RoHS, and UKCA, ensuring their applicability across various sectors."", ""The article emphasizes the importance of AI in increasing efficiency, precision, and automation in industrial operations."", ""The ReComputer series' design reduces maintenance needs and extends operational lifespan, crucial for industrial applications.""]",2023-05-16,Deval,Seeed Studio,"Unleash the power of AI in your industrial operations with Seeed Studio's ReComputer Industrial series. These state-of-the-art devices, built on NVIDIA's cutting-edge technology, offer unmatched computational performance and are designed to thrive in extreme conditions. From smart cities to medical imaging, explore how these AI solutions can transform your industry with precision and efficiency.","[""artificial intelligence"", ""computing"", ""IIoT"", ""industrial automation"", ""NVIDIA"", ""AI devices""]",Seeed Studio ReComputer Industrial AI Devices for Engineers,Explore Seeed Studio ReComputer: Industrial AI Devices for Enhanced Efficiency and Automation,https://www.wevolver.com/article/seeed-studio-recomputer-industrial-ai-devices-for-engineers
wevolver-com-article-revolutionizing-pipeline-inspection-the-power-of-the-rock-3-compute-module.md,"Pipeline industry professionals, technology enthusiasts, and companies seeking advanced inspection solutions.","[""The article discusses the crucial role of technology in pipeline inspection, emphasizing the need for smart solutions that improve safety and efficiency."", ""It introduces the OKdo ROCK 3 Compute Module (CM3) as a groundbreaking tool for enhancing pipeline inspections, highlighting its collaboration with Radxa."", ""The CM3 is described as a compact and powerful system-on-module leveraging the Rockchip RK3566 SoC, offering wireless connectivity ideal for remote inspections."", ""Key advantages include the ability to perform detailed monitoring and predictive maintenance, crucial for preventing leaks and ensuring operational excellence."", ""The article outlines various challenges faced in pipeline inspection, such as accessibility issues, continuous monitoring needs, and the risk of human error."", ""It emphasizes the benefits of advanced technologies like digital twin and non-destructive testing methods in addressing these challenges.""]",2000-01-01,Deval,OKdo Technology,"Unlock the future of pipeline inspection with the revolutionary OKdo ROCK 3 Compute Module. This compact powerhouse combines precision, connectivity, and performance, transforming how industries monitor and maintain crucial pipeline systems. Discover how this innovation ensures safety and efficiency across challenging environments.","[""Bluetooth"", ""sensors"", ""single board computer"", ""pipeline inspection"", ""technology innovation""]",Revolutionizing Pipeline Inspection: The Power of the ROCK 3 Compute Module,"Explore the transformative potential of the ROCK 3 Compute Module in revolutionizing pipeline inspection. Discover the power and versatility of this innovative solution, designed to enhance safety, efficiency, and operational excellence in infrastructure maintenance.",https://www.wevolver.com/article/revolutionizing-pipeline-inspection-the-power-of-the-rock-3-compute-module
v7labs-com-blog-generative-ai-guide.md,"Tech enthusiasts, AI researchers, business leaders, and digital innovators seeking to understand and leverage generative AI.","[""Generative AI is a transformative technology that creates new content using machine learning algorithms."", ""The article delves into the basics of generative AI, its techniques, and current ecosystem."", ""It highlights the breakthroughs in 2023, including the popularity of OpenAI's ChatGPT."", ""The article outlines practical applications of generative AI such as product design, process optimization, and creating virtual worlds."", ""Challenges and limitations of generative AI are discussed, along with its promising future potential.""]",2023-08-31,Deval,V7 Labs,"Dive into the world of Generative AI and discover how this groundbreaking technology is reshaping industries by creating innovative content across various media. Understand the immense potential and practical applications of AI, from optimizing business processes to generating virtual worlds. Learn about the latest tools, techniques, and the future of this transformative technology in our comprehensive guide.","[""Generative AI"", ""Artificial Intelligence"", ""Machine Learning"", ""AI Applications"", ""Technology Trends""]","Generative AI 101: Explanation, Use Cases, Impact","Let’s learn about generative AI from the ground up, look at its current ecosystem, and think about what’s next in store for the current GenAI hype.",https://www.v7labs.com/blog/generative-ai-guide
lakera-ai-blog-remote-code-execution.md,"Tech professionals, cybersecurity experts, AI enthusiasts, and business leaders interested in AI security trends and solutions.","[""The article introduces Lakera's GenAI Security Readiness Report for 2024, emphasizing the significance of preparing for AI security challenges."", ""It covers the most common vulnerabilities associated with Large Language Models (LLMs) and provides strategies to mitigate these risks."", ""The report aims to equip businesses and tech enthusiasts with knowledge to safeguard against data leaks and other security threats posed by AI systems."", ""The article also highlights the importance of understanding cookies, especially in the context of website interaction and privacy."", ""There's a focus on educating the audience about essential, marketing, personalization, and analytics cookies and their roles in enhancing user experience and tracking.""]",2000-01-01,Deval,Lakera,Unveil the latest in AI security with Lakera's 2024 GenAI Security Readiness Report. Learn about the top vulnerabilities threatening Large Language Models and discover actionable strategies to safeguard your data. Equip yourself with the knowledge to protect against the evolving landscape of AI threats and enhance your digital security posture. Download the report now to stay ahead in the AI security game!,"[""AI Security"", ""LLM Vulnerabilities"", ""Tech Report"", ""Data Privacy"", ""Digital Security""]",Remote Code Execution: A Guide to RCE Attacks & Prevention Strategies | Lakera – Protecting AI teams that disrupt the world.,"Remote Code Execution (RCE) is a serious threat. Discover what it is, why it's dangerous, and the vital steps you need to take to mitigate the risks.",https://www.lakera.ai/blog/remote-code-execution
wevolver-com-article-refining-ais-foundation-mastering-dataset-curation-for-machine-learning.md,"Data scientists, AI researchers, and tech industry professionals interested in enhancing machine learning outcomes through effective data management.","[""The article emphasizes the critical role of data curation in machine learning, highlighting its impact on model accuracy and efficiency."", ""It draws an analogy between data and oil, indicating that raw data requires refining to be valuable."", ""The piece underscores the increasing importance of dataset curation as AI becomes more integral across industries."", ""It outlines best practices in dataset curation, emphasizing the need for versioning, contextualization, and format selection for reusability."", ""The article also delves into data-specific curation strategies for sensor, audio, and image data, acknowledging the unique challenges each presents."", ""A key takeaway is the necessity of tailored data curation strategies, as opposed to a one-size-fits-all approach, to optimize machine learning outcomes.""]",2000-01-01,Deval,Wevolver,"Unlock the full potential of machine learning by mastering dataset curation. Discover essential strategies to refine raw data, ensuring high-quality inputs for your AI models. Tailor your approach to different data types and enhance both accuracy and efficiency in your projects. From versioning to contextualization, learn how to mitigate risks and maximize performance in AI applications.","[""artificial intelligence"", ""big data"", ""machine learning"", ""dataset curation"", ""data management""]",Refining AI's Foundation: Mastering Dataset Curation for Machine Learning,"Unlocking AI Potential Through Strategic Dataset Curation: A Comprehensive Guide for Enhancing Machine Learning Models
",https://www.wevolver.com/article/refining-ais-foundation-mastering-dataset-curation-for-machine-learning
aporia-com-learn-prompt-engineering.md,"AI enthusiasts, developers, researchers, and tech professionals interested in maximizing the utility of AI models.","[""The article introduces the concept of prompt engineering, explaining its importance in optimizing interactions with AI models like ChatGPT and Claude."", ""Prompt engineering involves crafting inputs to direct AI models toward producing more accurate and relevant outputs."", ""The article delves into the principles and strategies of prompt engineering, discussing techniques such as chain-of-thought prompting and few-shot learning."", ""It highlights the potential of prompt engineering to enhance AI capabilities across various domains while acknowledging its limitations, including dependency on prompt quality and bias risks."", ""The piece emphasizes the significance of prompt engineering skills in the workforce as AI technologies continue to evolve."", ""It also discusses advanced solutions like Aporia\u2019s Guardrails, which offer a framework for AI output control and quality assurance, potentially reducing the need for constant prompt adjustments.""]",2024-07-23,Deval,Aporia,Master the art of prompt engineering and unlock the true potential of AI models like ChatGPT. Learn techniques to craft precise inputs that drive accurate and relevant outputs. Discover how this skill can reshape AI interactions and explore advanced solutions for AI output control. Ideal for anyone keen on leveraging AI capabilities in their field.,"[""AI"", ""Prompt Engineering"", ""Generative AI"", ""Machine Learning"", ""Language Models""]",What is Prompt Engineering? Step-by-Step Guide + Examples,Learn what prompt engineering is with our step-by-step guide. Discover techniques and examples to master prompt engineering for your AI projects.,https://www.aporia.com/learn/prompt-engineering/
v7labs-com-blog-data-augmentation-guide.md,"AI researchers, data scientists, machine learning engineers, and tech enthusiasts interested in enhancing AI model performance through data augmentation techniques.","[""Data augmentation is a technique used to artificially increase the amount of data available for training AI models by generating new data points from existing data."", ""This process involves making minor alterations to the original dataset or using machine learning models to create new data in the latent space of the original data."", ""Data augmentation helps overcome challenges related to data scarcity by providing a cost-effective method to enhance the training dataset's quality and quantity."", ""The article covers essential aspects of data augmentation, including its definition, working mechanism, techniques used in computer vision, and prominent use cases."", ""The piece highlights the importance of data augmentation in building high-precision AI models more quickly and efficiently."", ""The article also introduces tools like V7 Image and Data Annotation, V7 Model Training, etc., that facilitate the process of annotating, managing, and training data for AI models.""]",2022-05-06,Deval,V7 Labs,"Unlock the potential of your AI models with data augmentation—a game-changing technique that tackles data scarcity head-on by generating new data points from existing datasets. This guide unravels the magic behind data augmentation, its pivotal role in deep learning, and how it can elevate your model's accuracy and performance. Dive in to discover powerful techniques and real-world use cases, and explore how V7's cutting-edge tools seamlessly integrate with your data augmentation strategy.","[""Data Augmentation"", ""Deep Learning"", ""AI Models"", ""Computer Vision"", ""Machine Learning""]",The Essential Guide to Data Augmentation in Deep Learning,"What is data augmentation, how does it work and what are its most prominent use cases? Learn everything you need to know about data augmentation techniques for computer vision.",https://www.v7labs.com/blog/data-augmentation-guide
